[
  {
    "event_id": "evt-20260918-001",
    "event_type": "TOPIC_MEETING_LOGGED",
    "aggregate_type": "editorial_item",
    "aggregate_id": "ed-2026-0918-01",
    "occurred_at": "2026-09-18T09:30:00+08:00",
    "version": 1,
    "summary": "选题会确定评论选题《社区食堂要办得长久》，明确基本观点与事实核查要求",
    "actor": { "id": "u-resp-01", "role": "responsible_editor" }
  },
  {
    "event_id": "evt-20260918-002",
    "event_type": "SOURCE_REGISTERED",
    "aggregate_type": "source_claim",
    "aggregate_id": "src-tjj-gb-2026h1",
    "occurred_at": "2026-09-18T10:15:00+08:00",
    "version": 1,
    "summary": "登记事实来源：省统计局《2026 年上半年全省社区养老服务统计公报》",
    "actor": { "id": "u-editor-01", "role": "editor" },
    "source_kind": "official_release",
    "sensitivity": "normal"
  },
  {
    "event_id": "evt-20260918-003",
    "event_type": "SOURCE_REGISTERED",
    "aggregate_type": "source_claim",
    "aggregate_id": "src-mjxs-0907",
    "occurred_at": "2026-09-18T10:20:00+08:00",
    "version": 1,
    "summary": "登记敏感线索：关于某社区食堂补贴使用情况的反映，仅限核查角色流转",
    "actor": { "id": "u-duty-01", "role": "duty_editor" },
    "source_kind": "tip_off",
    "sensitivity": "restricted",
    "visibility": ["legal_reviewer", "business_reviewer"]
  },
  {
    "event_id": "evt-20260918-004",
    "event_type": "DRAFT_SUBMITTED",
    "aggregate_type": "editorial_item",
    "aggregate_id": "ed-2026-0918-01",
    "occurred_at": "2026-09-18T14:00:00+08:00",
    "version": 2,
    "summary": "作者提交初稿《社区食堂要办得长久》",
    "actor": { "id": "u-author-01", "role": "author" },
    "refs": [
      { "aggregate_type": "source_claim", "aggregate_id": "src-tjj-gb-2026h1", "role": "source" }
    ]
  },
  {
    "event_id": "evt-20260918-005",
    "event_type": "DRAFT_REVIEWED",
    "aggregate_type": "editorial_item",
    "aggregate_id": "ed-2026-0918-01",
    "occurred_at": "2026-09-18T16:40:00+08:00",
    "version": 3,
    "summary": "编辑修订：压缩背景引语、核对数据引用口径并调整结尾",
    "actor": { "id": "u-editor-01", "role": "editor" }
  },
  {
    "event_id": "evt-20260918-006",
    "event_type": "CHECK_RECORDED",
    "aggregate_type": "editorial_item",
    "aggregate_id": "ed-2026-0918-01",
    "occurred_at": "2026-09-18T17:30:00+08:00",
    "version": 4,
    "summary": "法务核查通过：涉敏表述已按核查意见处理",
    "actor": { "id": "u-legal-01", "role": "legal_reviewer" },
    "check_type": "legal",
    "result": "passed",
    "refs": [
      { "aggregate_type": "source_claim", "aggregate_id": "src-mjxs-0907", "role": "source" }
    ]
  },
  {
    "event_id": "evt-20260918-007",
    "event_type": "CHECK_RECORDED",
    "aggregate_type": "editorial_item",
    "aggregate_id": "ed-2026-0918-01",
    "occurred_at": "2026-09-18T18:10:00+08:00",
    "version": 5,
    "summary": "业务核查有条件通过：统计数据须注明统计口径",
    "actor": { "id": "u-biz-01", "role": "business_reviewer" },
    "check_type": "business",
    "result": "conditional",
    "note": "两处统计数据需注明“上半年”口径",
    "refs": [
      { "aggregate_type": "source_claim", "aggregate_id": "src-tjj-gb-2026h1", "role": "source" }
    ]
  },
  {
    "event_id": "evt-20260919-001",
    "event_type": "AI_CANDIDATE_PROPOSED",
    "aggregate_type": "ai_candidate",
    "aggregate_id": "cand-ed-2026-0918-01-title",
    "occurred_at": "2026-09-19T09:05:00+08:00",
    "version": 1,
    "summary": "系统生成标题候选 3 条，仅供责任编辑选用",
    "actor": { "id": "sys-01", "role": "system" },
    "candidate_kind": "title",
    "status": "candidate",
    "candidates": [
      "社区食堂要办得长久",
      "暖胃更要暖心：社区食堂如何长久飘香",
      "社区食堂，便民之后如何可持续"
    ],
    "refs": [
      { "aggregate_type": "editorial_item", "aggregate_id": "ed-2026-0918-01", "role": "parent" }
    ]
  },
  {
    "event_id": "evt-20260919-002",
    "event_type": "AI_CANDIDATE_CONFIRMED",
    "aggregate_type": "ai_candidate",
    "aggregate_id": "cand-ed-2026-0918-01-title",
    "occurred_at": "2026-09-19T09:20:00+08:00",
    "version": 2,
    "summary": "责任编辑确认正式标题：《社区食堂要办得长久》",
    "actor": { "id": "u-resp-01", "role": "responsible_editor" },
    "confirmed_by": "u-resp-01",
    "refs": [
      { "aggregate_type": "editorial_item", "aggregate_id": "ed-2026-0918-01", "role": "parent" }
    ]
  },
  {
    "event_id": "evt-20260919-003",
    "event_type": "VARIANT_PREPARED",
    "aggregate_type": "channel_variant",
    "aggregate_id": "var-ed-2026-0918-01-print",
    "occurred_at": "2026-09-19T10:00:00+08:00",
    "version": 1,
    "summary": "纸版版面适配稿就绪（评论版）",
    "actor": { "id": "u-editor-01", "role": "editor" },
    "channel": "print",
    "variant_kind": "print_layout",
    "content_ref": "rev-ed-2026-0918-01-v1",
    "refs": [
      { "aggregate_type": "editorial_item", "aggregate_id": "ed-2026-0918-01", "role": "parent" },
      { "aggregate_type": "ai_candidate", "aggregate_id": "cand-ed-2026-0918-01-title", "role": "candidate" }
    ]
  },
  {
    "event_id": "evt-20260919-004",
    "event_type": "VARIANT_PREPARED",
    "aggregate_type": "channel_variant",
    "aggregate_id": "var-ed-2026-0918-01-client_app",
    "occurred_at": "2026-09-19T10:05:00+08:00",
    "version": 1,
    "summary": "客户端正文适配稿就绪",
    "actor": { "id": "u-editor-01", "role": "editor" },
    "channel": "client_app",
    "variant_kind": "article_body",
    "content_ref": "rev-ed-2026-0918-01-v1",
    "refs": [
      { "aggregate_type": "editorial_item", "aggregate_id": "ed-2026-0918-01", "role": "parent" },
      { "aggregate_type": "ai_candidate", "aggregate_id": "cand-ed-2026-0918-01-title", "role": "candidate" }
    ]
  },
  {
    "event_id": "evt-20260919-005",
    "event_type": "VARIANT_PREPARED",
    "aggregate_type": "channel_variant",
    "aggregate_id": "var-ed-2026-0918-01-short_video",
    "occurred_at": "2026-09-19T10:10:00+08:00",
    "version": 1,
    "summary": "短视频口播脚本就绪（90 秒）",
    "actor": { "id": "u-editor-01", "role": "editor" },
    "channel": "short_video",
    "variant_kind": "voiceover_script",
    "content_ref": "rev-ed-2026-0918-01-v1",
    "refs": [
      { "aggregate_type": "editorial_item", "aggregate_id": "ed-2026-0918-01", "role": "parent" },
      { "aggregate_type": "ai_candidate", "aggregate_id": "cand-ed-2026-0918-01-title", "role": "candidate" }
    ]
  },
  {
    "event_id": "evt-20260919-006",
    "event_type": "VARIANT_PREPARED",
    "aggregate_type": "channel_variant",
    "aggregate_id": "var-ed-2026-0918-01-social_card",
    "occurred_at": "2026-09-19T10:15:00+08:00",
    "version": 1,
    "summary": "社交平台卡片素材就绪",
    "actor": { "id": "u-editor-01", "role": "editor" },
    "channel": "social_card",
    "variant_kind": "social_card",
    "content_ref": "rev-ed-2026-0918-01-v1",
    "refs": [
      { "aggregate_type": "editorial_item", "aggregate_id": "ed-2026-0918-01", "role": "parent" },
      { "aggregate_type": "ai_candidate", "aggregate_id": "cand-ed-2026-0918-01-title", "role": "candidate" }
    ]
  },
  {
    "event_id": "evt-20260919-007",
    "event_type": "VARIANT_PREPARED",
    "aggregate_type": "channel_variant",
    "aggregate_id": "var-ed-2026-0918-01-partner_feed",
    "occurred_at": "2026-09-19T10:20:00+08:00",
    "version": 1,
    "summary": "合作平台推荐流素材就绪",
    "actor": { "id": "u-editor-01", "role": "editor" },
    "channel": "partner_feed",
    "variant_kind": "feed_payload",
    "content_ref": "rev-ed-2026-0918-01-v1",
    "refs": [
      { "aggregate_type": "editorial_item", "aggregate_id": "ed-2026-0918-01", "role": "parent" },
      { "aggregate_type": "ai_candidate", "aggregate_id": "cand-ed-2026-0918-01-title", "role": "candidate" }
    ]
  },
  {
    "event_id": "evt-20260919-008",
    "event_type": "VARIANT_APPROVED",
    "aggregate_type": "channel_variant",
    "aggregate_id": "var-ed-2026-0918-01-print",
    "occurred_at": "2026-09-19T10:40:00+08:00",
    "version": 2,
    "summary": "责任编辑确认纸版发布稿",
    "actor": { "id": "u-resp-01", "role": "responsible_editor" },
    "channel": "print",
    "approved_by": "u-resp-01"
  },
  {
    "event_id": "evt-20260919-009",
    "event_type": "VARIANT_APPROVED",
    "aggregate_type": "channel_variant",
    "aggregate_id": "var-ed-2026-0918-01-client_app",
    "occurred_at": "2026-09-19T10:42:00+08:00",
    "version": 2,
    "summary": "责任编辑确认客户端发布稿",
    "actor": { "id": "u-resp-01", "role": "responsible_editor" },
    "channel": "client_app",
    "approved_by": "u-resp-01"
  },
  {
    "event_id": "evt-20260919-010",
    "event_type": "VARIANT_APPROVED",
    "aggregate_type": "channel_variant",
    "aggregate_id": "var-ed-2026-0918-01-short_video",
    "occurred_at": "2026-09-19T10:44:00+08:00",
    "version": 2,
    "summary": "责任编辑确认短视频口播脚本",
    "actor": { "id": "u-resp-01", "role": "responsible_editor" },
    "channel": "short_video",
    "approved_by": "u-resp-01"
  },
  {
    "event_id": "evt-20260919-011",
    "event_type": "VARIANT_APPROVED",
    "aggregate_type": "channel_variant",
    "aggregate_id": "var-ed-2026-0918-01-social_card",
    "occurred_at": "2026-09-19T10:46:00+08:00",
    "version": 2,
    "summary": "责任编辑确认社交平台卡片",
    "actor": { "id": "u-resp-01", "role": "responsible_editor" },
    "channel": "social_card",
    "approved_by": "u-resp-01"
  },
  {
    "event_id": "evt-20260919-012",
    "event_type": "VARIANT_APPROVED",
    "aggregate_type": "channel_variant",
    "aggregate_id": "var-ed-2026-0918-01-partner_feed",
    "occurred_at": "2026-09-19T10:48:00+08:00",
    "version": 2,
    "summary": "责任编辑确认合作平台推荐流素材",
    "actor": { "id": "u-resp-01", "role": "responsible_editor" },
    "channel": "partner_feed",
    "approved_by": "u-resp-01"
  },
  {
    "event_id": "evt-20260919-013",
    "event_type": "PUBLISH_WINDOW_SET",
    "aggregate_type": "channel_variant",
    "aggregate_id": "var-ed-2026-0918-01-print",
    "occurred_at": "2026-09-19T11:00:00+08:00",
    "version": 3,
    "summary": "设定纸版付印窗口",
    "actor": { "id": "u-resp-01", "role": "responsible_editor" },
    "channel": "print",
    "window": { "not_before": "2026-09-20T00:30:00+08:00", "not_after": "2026-09-20T04:30:00+08:00" }
  },
  {
    "event_id": "evt-20260919-014",